<!ELEMENT BOOKS (BOOK*) >
<!ELEMENT BOOK (BOOK_TITLE, SUB_TITLE, AUTHOR+, PUB_YEAR) >
<!ELEMENT BOOK_TITLE (#PCDATA) >
<!ELEMENT SUB_TITLE EMPTY >
<!ELEMENT AUTHOR (#PCDATA)>
<!ELEMENT PUB_YEAR ANY>
<!ELEMENT REPRINT (#PCDATA)>
<!ELEMENT ISBN EMPTY>
